Latin,Français
"Galliæ, neque superesset multum","de la Gaule, et qu'il ne restait pas beaucoup"
"atque intelligeret id posse extrahi facile, imperat obsides, et constituit quid vectigalis Britannia penderet in singulos annos populo Romano : interdicit atque imperat Cassivellauno ne faciat bellum Mandubratius, ne Trinobantibus.","de l'été et qu'il comprenait ce reste d'été pouvoir être trainé-en-longueur (dépensé facilement, commande des otages, et établit (fixe) quoi de (quel) tribut la Bretagne payait pour chaque année (annuellement) au peuple romain : il défend et il commande à Cassivellaunus qu'il ne fasse pas la guerre à Mandubratius, ou (et) qu'il n'asse pas aux Trinobantes."
"XXIII. Obsidibus acceptis, reducit exercitum ad mare, invenit naverefectas.","XXIII. Les otages ayant été recus, il ramène son armée vers la mer, et trouve les vaisseaux réparés."
"His deductis, quod et habebat magnum numerum captivorum, et nonnullæ naves doperierant tempestate, instituit reportare exercitum duobus commentibus.","Ceux-ci étant lancés, parce que et il avait un grand nombre de prisonniers, et quelques vaisseaux avaient péri par la tempête, il résolut de ramener son armée en deux convois."
"Ac accidit sic, uti ex tanto numero navium, tot navigationibus, neque hoc, neque anno superiore, omnino ulla navis quae portaret milites desideraretur : at ex iis, quae remitterentur inanes ex continenti ad eum, militibus prioris commeatus expositis,","Et il arriva ainsi, que d'un si-grand nombre de vaisseaux, en tant de traversées, ni cette année-là, ni l'année précédente, absolument aucun vaisseau qui transportait des soldats ne fut regretté (perdu) : mais que de ceux, qui étaient renvoyés vides du continent vers lui, les soldats du premier convoi ayant été débarqués,"
