Latin,Français
"in quærendo, quod proclium equestre adversum factum esset","en interrogant, en ce qu'un combat de-cavalerie avait été fait (livré)"
"paucis diēbus ante, initium ejus fuga factum a Dumnorige atque equitibus ejus (nam Dumnorix præerat equitatu)","pen-de jours auparavant, le commencement de cette fuite avoir été fait par Dumnorix et les cavaliers de lui (car Dumnorix commandait la cavalerie)"
auxilio Cæsari); reliquum equitatum perterritum esse fuga eorum.,que les Éduens avaient envoyée au secours à César); le reste-de la cavalerie avoir été épouvanté par la fuite d'eux.
"XIX. Quibus rebus cognitis, quum res certissimæ arcederent ad has suspiciones, quod transduxisset Helvetios per fines Sequanorum, quod curasset obsides dandos inter eos, quod fecisset omnium ea non modo injussu suo et civitatis, sed etiam ipsis inscientibus, quod accusaretur a magistratu Æduorum, arbitrabatur satis causæ esse quare aut ipse animadverteret in eum, aut juberet civitatem animadvertere.","XIX. Lesquels faits étant connus, comme des faits très-certain-s'ajoutaient à ces soupcons, savoir qu'il avait fait-passer les Helvétiens à travers le territoire des Séquanieus, qu'il avait pris-soin d'otages devant être donnés entre eux, qu'il avait fait toutes ces choses non-seulement sans-l'ordre de-lui (César) et de la cité, mais même eux-mêmes (César et la cité) ne-le-sachant-pas, qu'il était accusé par le magistrat des Éduens, il (César) pensait assez de motif (un motif suffisant) être pour que ou lui-même il sevit contre lui, ou il ordonnât la cité sévir."
"Unum repugnabit omnibus his rebus, quod cognoverat studium summum Divitiaci fratri in populum Romanum, voluntatem summam in se, fidem egregiam, justitiam, temperantiam : sa justice, sa modération :","Une seule chose combattait tous ces motifs, qu'il connaissait le dévouement très-haut de Divitiacus frère de Dumnorix envers le peuple romain, sa bienveillance très-haute envers lui-"
"fide, bonne-foi distinguée, justitiam, temperantiam : sa justice, sa modération :","fide, bonne-foi distinguée, justitiam, temperantiam : sa justice, sa modération :"
