Latin,Français
Rhenum subesse,le Rhin être proche
mortem Ariovisti et nostras victorias superiores esse magno dolori,la mort d'Arioviste et nos victoires antérieures être (causer un) grand ressentiment
"Germanis; Galliam ardere, redactam sub imperium populi Romani, tot contumeliis acceptis, superiore gloria rei militaris exstincta.","aux Germains; la Gaule être ardente, elle réduite sous l'empire du peuple romain, tant d'outrages ayant été recus, son ancienne gloire de (dans) l'art de-la-guerre ayant été éteinte (anéantie)."
"Postremo, quis persuaderet hoc sibi, Ambiorigem descendisse ad consilium ejusmodi sine re certa?","Enfin, qui pourrait persuader ceci à soi-même, Ambiorix être descendu (en âtre venu) à une résolution de-cette-sorté sans un but certain?"
"Suam sententiam esse tutam in utramque partem : si sit nihil durius, perventuros nullo periculo ad legionem proximam; si omnis Gallia consentiat cum Germanis, unam salutem esse positam in celeritate.","être sûr de l'un-ét-l'autre côté : [l'ordinaire, s'il n'y avait rien de plus facheux qu'à euer devoir arriver sans aucun péril. auprès de la légion la plus proche; si tonte la Gaule était-d'accord avec les Germains, un seul moyen de salut exister reposant sur la promptitude."
Quem exitum quidem haberet consilium Cotta atque eorum atque eorum qui dissentirent?,Quelle issue à la vérité avait l'avis de Cotta et de ceux qui différaient-de-sentiment avec Titurius?
"In quo si non periculum præsens, si non periculum præsens, at certe fames longinqua obidione esset pertimescenda.","Dans lequel (en le suivant) si non un danger présent, mais du moins une famine causée par un long siège était à-redouter."
"XXX. Hac disputatione habita in utramque partem, quum resisteretur acriter Cotta primisque ordinibus : ""Vincite, si vultis ita,"" inquit Sabinus, ""inquit Sabinus, et id vocelariore, ut magna pars militum""","XXX. Cette discussion ayant été tenue (faite) dans l'un-ét-l'autre sens, comme il était résisté vivement du-côte-de Cotta et des centurions des premiers rangs : ""Emportez-le, si vous voulez ainsi,"" dit Sabinus, et cela d'une voix plus éclatante, pour qu'une grande partie des soldats"
