Latin,Français
exaudiret,entendit
"Neque sum is, inquit, qui terrear gravissime ex vobis","Et je ne suis pas un tel homme, qui sois effrayé le plus fortement d'entre vous"
"periculo mortis : hi sapient, et, si quid gravius acciderit,","par un péril de mort : ceux-ci seront-sages, et, si quelque chose de plus lourd (quelque de-est arrivé,"
"reposcent rationem abs te; qui, si liccat per te, die perendino conjuncti cum hibernis proximis, sustineant casum belli communem cum reliquis, nec interant aut ferro aut fame","en demanderont raison à toi; qui, si liccat per te, die perendino conjuncti cum hibernis proximis, sustineant casum belli communem cum reliquis, nec interant aut ferro aut fame"
aut fame rejecti et relegati longe ab ceteris. XXXI. Consurgitur ex concilio; comprendunt utrumque et orant,aut fame rejecti et relegati longe ab ceteris. XXXI. On se lève du conseil; les assistants saisissent l'un-ét-l'autre et les prient
"Ne sua dissensione et pertinacia deducant rem ad summum periculum : rem esse facilem, seu maneant, seu proficiscantur, si modo omnes sentiant ac probent unum; contra in dissensione se porspicere nullam salutem.","Que par leur dissentiment et leur opiniâtreté ils n'ambent pas l'affaire ils n'ambent pas l'affaire à un extrême danger : la situation être facile, soit qu'ils restent, soit qu'ils partent, si seulement tous pensaient et approuvaient une même chose; au-co-contre dans le dissentiment eux-mêmes n'entrevoir aucun salut."
"Res perducitur disputatione ad medium noctem. Tandem Cotta permotus dat manus; sententia Sabini imperat. Pronuntiatur ituros prima luce; ituros prima luce; pars reliqua noctis consumitur vigilis, quum quisque miles circumspiceret sua,","L'affaire est menée par la discussion jusqu'au milieu-de la nuit. Enfin Cotta ébranlé donne les mains (cède); l'avis de Sabinus l'emporte. On déclare les soldats devoir marcher au point-du la partie qui-reste de la nuit la partie qui-reste de la nuit est passée dans la veille (sans dormir), tandis que chaque soldat examinait ses bagages,"
