Latin,Français
"ponebant omnem spem in celeritate, atque, adepti haec victoriam, hanc victoriam, confident se fore victores in perpetuum.","placasient tout leur espoir dans la promptitude, et, ayant acquis cette victoire, avaient-confiance eux-mêmes devoir être vainqueurs à jamais."
"XL. Litterae mittuntur confestim ab Cicerone ad Caesarem, magnis præmiis propositis, si pertulissent. Omnibus viis obsessis, missi intercipiuntur.","XL. Une lettre est envoyée à la hâte par Cicerone à César, de grandes récompenses étant proposées, si les messagers la portaient-jusqu'au- Toutes les routes étant assiégées, les messagers sont interceptés."
"Noctu [modum centum viginti turres ad- cent vingt tours à peu près excitantur celeritate incredibili ex ea materia, quam comportaverant causa munitionis: quæ videbantur deesse operi perficiuntur.","Pendant la nuit cent vingt tours à peu près sont élevés avec une rapidité incroyable avec ce bois, qu'ils avaient amassé en vue de la fortification : les choses qui paraissaient manquer à l'œuvre du retranchement sont achevées."
"Hostes die postero, coplis multo majoribus concidis, oppugnant castra, complent fossam.","Les ennemis le jour suivant, des forces beaucoup plus grandes ayant été assemblées, assaillent le camp, complent le fossé."
Resistitur ab nostris eadem ratione qua pridie: hoc idem fit deinceps diebus reliquis.,Résistance-est-faite par les nôtres de la même façon que la veille : cette même chose se fait successivement les jours de-reste (suivants).
Nulla pars temporis nocturni intermittitur d laborem ;,Nulle partie du temps de-la-nuit n'est laissée-en-intervalle pour le travail ;
"facultas quietis datur non aegris, non vulneratis;","la facilité du repos n'est donnés ni aux malades, ni aux blessés ;"
quæcumque sunt opus ad oppugnationem diei proximi,tontes les choses qui sont un besoin (né- pour soutenir l'assaut du jour suivant
"comparantur noctu : multas sudes preustes, magnus numerus pilorum muralium instituitur;","sont préparées de nuit : beaucoup de pieux brûlés-par-le-bout, un grand nombre de javelots de-rempart est entrepris ;"
