Latin,Français
"rem esse testimonio, quod suatinuerint fortissime primum impetum hostium, multis vulneribus illatis ultro; non premi re frumentaria; interea auxilia conventura, et ex hibernis proximis et a Cæsare : postremo, quid esse levius aut turpius, quam capere consilium de rebus summis, hoste auctore?","ce fait être à témoignage (le prouver). qu'ils avaient soutenu très-bravement le premier choc des ennemis, de nombreuses blessures ayant été portées en outre; avant été portées en outre; par l'approvisionnement de-blé; pendant-ce-temps des secours devoir arriver-ensemble et des quartiers-d'hiver les plus proches et d'au-près de César : enfin, quoi être (qu'y avait-il) de plus léger ou de plus honteux, que de prendre résolution sur les affaires les plus élevées, l'ennemi étant conseiller ?"
XXIX. Contra ea Titurius clamitabat,XXIX. En-réponse-à ces raisons Titurius s'écriait
"Facturos sero, quum manus hostium majores,",[itrop tard.
"Germanis adjunctis, convenissent; aut, quum aliquid calamitatis acceptum esset in hiberuis proximis, occasionem consulendi esse brevem;","Eux devoir faire cela (prendre un parti), quand des troupes d'ennemis plus grandes, les Germains leur étant adjoints, se seraient réunies ; ou, lorsque quelque chose de (quelque) désastre aurait été recu (essuyé) dans les quartiers-d'hiver les plus pro- l'opportunité de délibérer être courte;"
arbitrari,lui-même penser
"Cæsarem profectum in Italiam : aliter neque Carnutes capturos fuisse consilium interfiendi Tasgetii, neque Eburones, si ille adesset, venturos esse ad castra cum tanta contemptione nostri.","César être parti pour l'Italie : autrement ni les Carnutes n'avaient du prendre (n'auraient pris) la résolution de tuer Tasgétius, ni les Eburones, si celui-là (César) était été-présent, n'avoir du venir (ne seraient venus) vers le camp avec un si-grand mépris de (pour) nous."
"Non spectare hostem auctorem, sed rem;","Lui-même ne pas considérer (de l'ennemi), l'ennemi se portant garant (les assertions mais le fait ;"
