Latin,Français
"ad Magetobriam, imperare superbe et crudeliter","près de Magétobria, commander orgueilleusement et cruellement"
poscere obides liberos,demander comme otages les enfants
"liberos ejusque nobilissimi, et edere in eos omniam exempla crueciatusque, si qua res non facta sit ad nutum aut ad voluntatem ejus.","les enfants de tout Gaulois le plus noble, et commettre contre eux tous les exemples (genres) et les tourments (de tourments), si quelque chose n'avait pas été faite au premier signe ou à la volonté de lui."
"Esse hominem barbarum, iracandum, temerarium; imperia ejus non possesu-tineri diutius.","Esse hominem barbarum, iracandum, temerarium; imperia ejus non possesu-tineri diutius."
"Nisi si quid auxilii sit in Cesare populoque Romano, idem quod Helvetii fecerint faciendum esse omnibus Gallis,","Nisi si quid auxilii sit in Cesare populoque Romano, idem quod Helvetii fecerint faciendum esse omnibus Gallis,"
"at emigrent domo, petant aliud domicilium, alias sedes, remotas a Germanis, experianturque fortunam, quæcumque accidat.","at emigrent domo, petant aliud domicilium, alias sedes, remotas a Germanis, experianturque fortunam, quæcumque accidat."
"Si hæc enuntiata sint Ariovisto, non dubitare quin sumat supplicium gravisimum de omnibus obsidibus qui sint apud eum.","Si hæc enuntiata sint Ariovisto, non dubitare quin sumat supplicium gravisimum de omnibus obsidibus qui sint apud eum."
"Cesarem posse vel auctoritate sua atque exercitus, vel recenti victoria, vel nomine populi Romani, deterere ne multitudo major Germanorum transducatur Rhenum; posseque defendere omnem Galliam ab injuria Ariovisti.","Cesarem posse vel auctoritate sua atque exercitus, vel recenti victoria, vel nomine populi Romani, deterere ne multitudo major Germanorum transducatur Rhenum; posseque defendere omnem Galliam ab injuria Ariovisti."
"César pouvoir soit par l'autorité de-lui-même et de son armée, soit par sa récente victoire, soit par le nom du peuple romain, empêcher-par-la-terreur qu'une multitude plus grande de Germains ne soit amée-au-dela du Rhin ; et pouvoir défendre toute la Gaule de la tyrannie d'Arioviste.","César pouvoir soit par l'autorité de-lui-même et de son armée, soit par sa récente victoire, soit par le nom du peuple romain, empêcher-par-la-terreur qu'une multitude plus grande de Germains ne soit amée-au-dela du Rhin ; et pouvoir défendre toute la Gaule de la tyrannie d'Arioviste."
